<?xml version="1.0"?>
	<!DOCTYPE pinfo SYSTEM "1.dtd">
	<pinfo>
		<roll>12</roll>
		<name>Aagan</name>
		<address>$%^TYHUN</address>
		<mobile>7046465749</mobile>
		<dob>040306</dob>
		<age>18</age>
		<quali>IT</quali>
	</pinfo>